{
  "schema_version": "1.0",
  "id": "ml-experiment-report",
  "kind": "model-evaluation-report",
  "media_type": "application/json",
  "digest": "sha256:2222222222222222222222222222222222222222222222222222222222222222",
  "size_bytes": 9127,
  "producer": {
    "run_id": "ml-experiment-run-001",
    "task_attempt_id": "ml-experiment-evaluate-attempt-1",
    "assignment_id": "ml-experiment-evaluate"
  },
  "created_at": "2026-07-27T15:30:00Z",
  "location": {
    "kind": "external",
    "uri": "file:///fixture/artifacts/ml-experiment-report.json"
  },
  "metadata": {
    "dataset_digest": "sha256:1111111111111111111111111111111111111111111111111111111111111111",
    "candidate_count": 2
  }
}
